<?xml version="1.0" encoding="UTF-8"?>

<!--
Project: UBmatrix Processing Engine
Version: 3.5.0
Date:    6-15-2009

Software Copyright (c) 2002-2009 UBmatrix, Inc., All Rights Reserved
-->

<xs:schema elementFormDefault="qualified" xmlns:xs="http://www.w3.org/2001/XMLSchema">
	<xs:import namespace="http://www.w3.org/XML/1998/namespace" schemaLocation="http://www.w3.org/2001/xml.xsd"/>
	<xs:element name="localization">
		<xs:complexType mixed="true">
			<xs:sequence>
				<xs:element name="uri" maxOccurs="unbounded">
					<xs:complexType>
						<xs:sequence>
							<xs:element name="LocalizedString" maxOccurs="unbounded">
								<xs:complexType>
									<xs:simpleContent>
										<xs:extension base="xs:string">
											<xs:attribute ref="xml:lang" use="required"/>
											<xs:attribute name="group" type="xs:string" use="optional"/>
										</xs:extension>
									</xs:simpleContent>
								</xs:complexType>
							</xs:element>
							<xs:element name="Reference" minOccurs="0">
								<xs:complexType>
									<xs:sequence>
										<xs:element name="Text" minOccurs="0" maxOccurs="unbounded">
											<xs:complexType>
												<xs:simpleContent>
													<xs:extension base="xs:string">
														<xs:attribute ref="xml:lang" use="required"/>
													</xs:extension>
												</xs:simpleContent>
											</xs:complexType>
										</xs:element>
										<xs:element name="Uri" type="xs:string" minOccurs="0"/>
									</xs:sequence>
								</xs:complexType>
							</xs:element>
						</xs:sequence>
						<xs:attribute name="id" type="xs:string" use="required"/>
					</xs:complexType>
				</xs:element>
				<xs:element name="locale" maxOccurs="unbounded">
					<xs:complexType>
						<xs:sequence>
							<xs:element name="LocalizedString" maxOccurs="unbounded">
								<xs:complexType>
									<xs:simpleContent>
										<xs:extension base="xs:string">
											<xs:attribute ref="xml:lang" use="required"/>
										</xs:extension>
									</xs:simpleContent>
								</xs:complexType>
							</xs:element>
						</xs:sequence>
						<xs:attribute name="id" type="xs:string" use="required"/>
					</xs:complexType>
				</xs:element>
			</xs:sequence>
		</xs:complexType>
		<xs:unique name="UniqueMemoID">
			<xs:selector xpath=".//*"/>
			<xs:field xpath="@id"/>
		</xs:unique>
	</xs:element>
</xs:schema>

<!--
The contents of this file are subject to the End-User Software License Agreement (the "License"). You may not use this 
file except in compliance with the License. A current copy of the License is available by contacting product support.

Software distributed under the License is distributed on an "AS IS" basis, WITHOUT WARRANTY OF ANY KIND, either express or 
implied. See the License for the specific language governing rights and limitations under the License.
-->